{
  "schemaVersion": "2", "id": "release-forge", "version": "1.0.0", "priority": 19, "license": "Apache-2.0", "locales": ["zh-CN", "en"], "assets": [], "assetDigest": "4f53cda18c2baa0c0354bb5f9a3ecbe5ed12ab4d8e11ba873c2f11161202b945", "contentDigest": "aeb96ec18d91952c396a70396950ac9918f32b852c788df161c3f51f7f80cd68", "preview": "preview.json",
  "matches": { "categories": ["system.deploy"], "states": ["waiting", "holding", "executing", "succeeded", "failed", "denied", "deferred", "expired", "stale"] },
  "variants": [
    { "id": "forge-armed", "when": [{ "field": "status", "op": "eq", "value": "waiting" }], "beats": [{ "phase": "cue", "commands": [{ "channel": "light", "token": "forge.arm", "durationMs": 900 }, { "channel": "audio", "cue": "forge.arm", "gain": "quiet" }, { "channel": "screen", "template": "发布工坊已升温，等待一道可信的落锤。", "slots": [] }] }], "timeline": { "durationMs": 2100, "tracks": [{ "atMs": 0, "command": "spawn", "id": "forge", "kind": "forge", "anchor": "center" }, { "atMs": 80, "command": "spawn", "id": "anvil", "kind": "anvil", "anchor": "bottom" }, { "atMs": 160, "command": "spawn", "id": "shield", "kind": "shield", "anchor": "top" }, { "atMs": 220, "command": "pulse", "id": "forge", "to": 1.18, "count": 3, "durationMs": 1220 }, { "atMs": 680, "command": "text", "id": "summary", "slot": "actionSummary", "anchor": "bottom" }] } },
    { "id": "forge-locking", "when": [{ "field": "status", "op": "eq", "value": "holding" }], "beats": [{ "phase": "decision", "commands": [{ "channel": "light", "token": "forge.lock", "durationMs": 920 }, { "channel": "audio", "cue": "forge.strike", "gain": "quiet" }, { "channel": "screen", "template": "正在把这次发布锻入确认。", "slots": [] }] }], "timeline": { "durationMs": 1500, "tracks": [{ "atMs": 0, "command": "spawn", "id": "forge", "kind": "forge", "anchor": "center" }, { "atMs": 0, "command": "spawn", "id": "anvil", "kind": "anvil", "anchor": "bottom" }, { "atMs": 70, "command": "holdProgress", "id": "hold" }, { "atMs": 150, "command": "pulse", "id": "forge", "to": 1.32, "count": 2, "durationMs": 1000 }, { "atMs": 520, "command": "shake", "id": "anvil", "amplitude": 9, "durationMs": 580 }] } },
    { "id": "forge-striking", "when": [{ "field": "status", "op": "eq", "value": "executing" }], "beats": [{ "phase": "resolution", "commands": [{ "channel": "light", "token": "forge.strike", "durationMs": 1800 }, { "channel": "audio", "cue": "forge.strike", "gain": "quiet" }, { "channel": "screen", "template": "工坊正在把发布打磨成稳定的形状。", "slots": [] }] }], "timeline": { "durationMs": 2300, "tracks": [{ "atMs": 0, "command": "spawn", "id": "forge", "kind": "forge", "anchor": "center" }, { "atMs": 0, "command": "spawn", "id": "anvil", "kind": "anvil", "anchor": "bottom" }, { "atMs": 100, "command": "spawn", "id": "spark", "kind": "shard", "anchor": "center" }, { "atMs": 160, "command": "orbit", "id": "spark", "anchor": "center", "radius": 0.3, "turns": 1.5, "durationMs": 1360 }, { "atMs": 260, "command": "pulse", "id": "forge", "to": 1.3, "count": 3, "durationMs": 1200 }, { "atMs": 1160, "command": "particle", "id": "strike", "anchor": "center" }] } },
    { "id": "forge-stable", "when": [{ "field": "status", "op": "eq", "value": "succeeded" }], "beats": [{ "phase": "resolution", "commands": [{ "channel": "light", "token": "forge.stable", "durationMs": 1500 }, { "channel": "audio", "cue": "forge.stable" }, { "channel": "speech", "template": "发布已锻造完成，执行服务正在接手。", "slots": [] }] }], "timeline": { "durationMs": 2100, "tracks": [{ "atMs": 0, "command": "spawn", "id": "forge", "kind": "forge", "anchor": "center" }, { "atMs": 80, "command": "spawn", "id": "shield", "kind": "shield", "anchor": "center" }, { "atMs": 150, "command": "pulse", "id": "shield", "to": 1.45, "count": 2, "durationMs": 1040 }, { "atMs": 680, "command": "particle", "id": "stable", "anchor": "center" }, { "atMs": 1250, "command": "text", "id": "summary", "slot": "actionSummary", "anchor": "bottom" }] } },
    { "id": "forge-cooled", "when": [{ "field": "status", "op": "eq", "value": "failed" }], "beats": [{ "phase": "resolution", "commands": [{ "channel": "light", "token": "forge.failed", "durationMs": 700 }, { "channel": "audio", "cue": "error.soft", "gain": "quiet" }, { "channel": "screen", "template": "火候已经熄灭，部署没有开始。", "slots": [] }] }], "timeline": { "durationMs": 1120, "tracks": [{ "atMs": 0, "command": "spawn", "id": "forge", "kind": "forge", "anchor": "center" }, { "atMs": 120, "command": "shake", "id": "forge", "amplitude": 12, "durationMs": 580 }, { "atMs": 740, "command": "fade", "id": "forge", "to": 0.15 }] } },
    { "id": "forge-denied", "when": [{ "field": "status", "op": "eq", "value": "denied" }], "beats": [{ "phase": "resolution", "commands": [{ "channel": "light", "token": "decision.denied", "durationMs": 470 }, { "channel": "screen", "template": "落锤没有发生，部署保持关闭。", "slots": [] }] }], "timeline": { "durationMs": 820, "tracks": [{ "atMs": 0, "command": "spawn", "id": "anvil", "kind": "anvil", "anchor": "center" }, { "atMs": 180, "command": "fade", "id": "anvil", "to": 0.2 }, { "atMs": 300, "command": "particle", "id": "rest", "anchor": "center" }] } },
    { "id": "forge-deferred", "when": [{ "field": "status", "op": "eq", "value": "deferred" }], "beats": [{ "phase": "resolution", "commands": [{ "channel": "light", "token": "decision.deferred", "durationMs": 460 }, { "channel": "screen", "template": "发布坯料已放到稍后处理架。", "slots": [] }] }], "timeline": { "durationMs": 900, "tracks": [{ "atMs": 0, "command": "spawn", "id": "forge", "kind": "forge", "anchor": "center" }, { "atMs": 140, "command": "pulse", "id": "forge", "to": 0.7, "count": 1, "durationMs": 500 }, { "atMs": 690, "command": "fade", "id": "forge", "to": 0.42 }] } },
    { "id": "forge-expired", "when": [{ "field": "status", "op": "eq", "value": "expired" }], "beats": [{ "phase": "resolution", "commands": [{ "channel": "light", "token": "quiet.fade", "durationMs": 420 }, { "channel": "screen", "template": "火候已散，确认没有释放部署。", "slots": [] }] }], "timeline": { "durationMs": 820, "tracks": [{ "atMs": 0, "command": "spawn", "id": "forge", "kind": "forge", "anchor": "center" }, { "atMs": 160, "command": "fade", "id": "forge", "to": 0.08 }, { "atMs": 420, "command": "text", "id": "status", "slot": "status", "anchor": "bottom" }] } },
    { "id": "forge-stale", "when": [{ "field": "status", "op": "eq", "value": "stale" }], "beats": [{ "phase": "resolution", "commands": [{ "channel": "light", "token": "warning.stale", "durationMs": 640 }, { "channel": "screen", "template": "发布材料已变化，请重新锻造确认。", "slots": [] }] }], "timeline": { "durationMs": 1020, "tracks": [{ "atMs": 0, "command": "spawn", "id": "shield", "kind": "shield", "anchor": "center" }, { "atMs": 120, "command": "shake", "id": "shield", "amplitude": 10, "durationMs": 520 }, { "atMs": 720, "command": "particle", "id": "unlock", "anchor": "center" }] } }
  ]
}
