{
  "schemaVersion": "2", "id": "time-garden", "version": "1.0.0", "priority": 19, "license": "Apache-2.0", "locales": ["zh-CN", "en"], "assets": [], "assetDigest": "4f53cda18c2baa0c0354bb5f9a3ecbe5ed12ab4d8e11ba873c2f11161202b945", "contentDigest": "418aff78a4f2959f187a7525423208186a55cb6871932134f1f1c76214521ac9", "preview": "preview.json",
  "matches": { "categories": ["calendar.create"], "states": ["waiting", "holding", "executing", "succeeded", "failed", "denied", "deferred", "expired", "stale"] },
  "variants": [
    { "id": "garden-seed", "when": [{ "field": "status", "op": "eq", "value": "waiting" }], "beats": [{ "phase": "cue", "commands": [{ "channel": "light", "token": "garden.seed", "durationMs": 900 }, { "channel": "audio", "cue": "garden.seed", "gain": "quiet" }, { "channel": "screen", "template": "一颗新的时间种子正在等待落下。", "slots": [] }] }], "timeline": { "durationMs": 2100, "tracks": [{ "atMs": 0, "command": "spawn", "id": "clock", "kind": "clock", "anchor": "top" }, { "atMs": 80, "command": "spawn", "id": "seed", "kind": "seed", "anchor": "center" }, { "atMs": 180, "command": "orbit", "id": "seed", "anchor": "center", "radius": 0.2, "turns": 0.6, "durationMs": 1160 }, { "atMs": 640, "command": "text", "id": "summary", "slot": "actionSummary", "anchor": "bottom" }] } },
    { "id": "garden-tending", "when": [{ "field": "status", "op": "eq", "value": "holding" }], "beats": [{ "phase": "decision", "commands": [{ "channel": "light", "token": "garden.tend", "durationMs": 900 }, { "channel": "audio", "cue": "garden.tend", "gain": "quiet" }, { "channel": "screen", "template": "正在为这段时间浇下确认。", "slots": [] }] }], "timeline": { "durationMs": 1500, "tracks": [{ "atMs": 0, "command": "spawn", "id": "seed", "kind": "seed", "anchor": "center" }, { "atMs": 0, "command": "spawn", "id": "clock", "kind": "clock", "anchor": "top" }, { "atMs": 80, "command": "holdProgress", "id": "hold" }, { "atMs": 150, "command": "pulse", "id": "seed", "to": 1.5, "count": 2, "durationMs": 1050 }, { "atMs": 220, "command": "rotate", "id": "clock", "turns": 0.3, "durationMs": 920 }] } },
    { "id": "garden-growing", "when": [{ "field": "status", "op": "eq", "value": "executing" }], "beats": [{ "phase": "resolution", "commands": [{ "channel": "light", "token": "garden.tend", "durationMs": 1700 }, { "channel": "audio", "cue": "garden.tend", "gain": "quiet" }, { "channel": "screen", "template": "这段时间正在从日历土壤里长出来。", "slots": [] }] }], "timeline": { "durationMs": 2300, "tracks": [{ "atMs": 0, "command": "spawn", "id": "seed", "kind": "seed", "anchor": "center" }, { "atMs": 0, "command": "spawn", "id": "clock", "kind": "clock", "anchor": "top" }, { "atMs": 200, "command": "pulse", "id": "seed", "to": 1.36, "count": 2, "durationMs": 620 }, { "atMs": 760, "command": "fade", "id": "seed", "to": 0.08 }, { "atMs": 810, "command": "spawn", "id": "sprout", "kind": "sprout", "anchor": "center" }, { "atMs": 880, "command": "pulse", "id": "sprout", "to": 1.38, "count": 2, "durationMs": 920 }, { "atMs": 1240, "command": "particle", "id": "growth", "anchor": "center" }] } },
    { "id": "garden-bloom", "when": [{ "field": "status", "op": "eq", "value": "succeeded" }], "beats": [{ "phase": "resolution", "commands": [{ "channel": "light", "token": "garden.bloom", "durationMs": 1500 }, { "channel": "audio", "cue": "garden.bloom" }, { "channel": "speech", "template": "这段时间已经在日程里开花。", "slots": [] }] }], "timeline": { "durationMs": 2100, "tracks": [{ "atMs": 0, "command": "spawn", "id": "sprout", "kind": "sprout", "anchor": "center" }, { "atMs": 260, "command": "spawn", "id": "bloom", "kind": "bloom", "anchor": "center" }, { "atMs": 300, "command": "pulse", "id": "bloom", "to": 1.45, "count": 2, "durationMs": 1040 }, { "atMs": 760, "command": "particle", "id": "petals", "anchor": "center" }, { "atMs": 1260, "command": "text", "id": "summary", "slot": "actionSummary", "anchor": "bottom" }] } },
    { "id": "garden-frost", "when": [{ "field": "status", "op": "eq", "value": "failed" }], "beats": [{ "phase": "resolution", "commands": [{ "channel": "light", "token": "garden.failed", "durationMs": 700 }, { "channel": "audio", "cue": "error.soft", "gain": "quiet" }, { "channel": "screen", "template": "种子没有种下，日程没有创建。", "slots": [] }] }], "timeline": { "durationMs": 1120, "tracks": [{ "atMs": 0, "command": "spawn", "id": "seed", "kind": "seed", "anchor": "center" }, { "atMs": 120, "command": "shake", "id": "seed", "amplitude": 8, "durationMs": 560 }, { "atMs": 720, "command": "fade", "id": "seed", "to": 0.12 }] } },
    { "id": "garden-denied", "when": [{ "field": "status", "op": "eq", "value": "denied" }], "beats": [{ "phase": "resolution", "commands": [{ "channel": "light", "token": "decision.denied", "durationMs": 460 }, { "channel": "screen", "template": "种子仍在掌心，日程没有创建。", "slots": [] }] }], "timeline": { "durationMs": 820, "tracks": [{ "atMs": 0, "command": "spawn", "id": "seed", "kind": "seed", "anchor": "center" }, { "atMs": 180, "command": "fade", "id": "seed", "to": 0.18 }, { "atMs": 290, "command": "particle", "id": "rest", "anchor": "center" }] } },
    { "id": "garden-deferred", "when": [{ "field": "status", "op": "eq", "value": "deferred" }], "beats": [{ "phase": "resolution", "commands": [{ "channel": "light", "token": "decision.deferred", "durationMs": 460 }, { "channel": "screen", "template": "时间种子留待稍后播种。", "slots": [] }] }], "timeline": { "durationMs": 900, "tracks": [{ "atMs": 0, "command": "spawn", "id": "seed", "kind": "seed", "anchor": "center" }, { "atMs": 130, "command": "pulse", "id": "seed", "to": 0.68, "count": 1, "durationMs": 500 }, { "atMs": 700, "command": "fade", "id": "seed", "to": 0.42 }] } },
    { "id": "garden-expired", "when": [{ "field": "status", "op": "eq", "value": "expired" }], "beats": [{ "phase": "resolution", "commands": [{ "channel": "light", "token": "quiet.fade", "durationMs": 420 }, { "channel": "screen", "template": "季节过去，确认没有创建日程。", "slots": [] }] }], "timeline": { "durationMs": 820, "tracks": [{ "atMs": 0, "command": "spawn", "id": "seed", "kind": "seed", "anchor": "center" }, { "atMs": 150, "command": "fade", "id": "seed", "to": 0.08 }, { "atMs": 420, "command": "text", "id": "status", "slot": "status", "anchor": "bottom" }] } },
    { "id": "garden-stale", "when": [{ "field": "status", "op": "eq", "value": "stale" }], "beats": [{ "phase": "resolution", "commands": [{ "channel": "light", "token": "warning.stale", "durationMs": 640 }, { "channel": "screen", "template": "时间土壤已经变化，请重新确认。", "slots": [] }] }], "timeline": { "durationMs": 1020, "tracks": [{ "atMs": 0, "command": "spawn", "id": "clock", "kind": "clock", "anchor": "center" }, { "atMs": 100, "command": "shake", "id": "clock", "amplitude": 9, "durationMs": 540 }, { "atMs": 720, "command": "particle", "id": "rewind", "anchor": "center" }] } }
  ]
}
