{
  "schemaVersion": "2", "id": "inkwell-atelier", "version": "1.0.0", "priority": 19, "license": "Apache-2.0", "locales": ["zh-CN", "en"], "assets": [], "assetDigest": "4f53cda18c2baa0c0354bb5f9a3ecbe5ed12ab4d8e11ba873c2f11161202b945", "contentDigest": "f8f186416dddfb4e980cac6eabb2c0a4b55973c8afe9e0e06e79f3ee367908ff", "preview": "preview.json",
  "matches": { "categories": ["communication.send"], "states": ["waiting", "holding", "executing", "succeeded", "failed", "denied", "deferred", "expired", "stale"] },
  "variants": [
    { "id": "ink-ready", "when": [{ "field": "status", "op": "eq", "value": "waiting" }], "beats": [{ "phase": "cue", "commands": [{ "channel": "light", "token": "ink.ready", "durationMs": 880 }, { "channel": "audio", "cue": "ink.dip", "gain": "quiet" }, { "channel": "screen", "template": "墨水正在聚拢成一封准备写下的信。", "slots": [] }] }], "timeline": { "durationMs": 2000, "tracks": [{ "atMs": 0, "command": "spawn", "id": "ink", "kind": "inkwell", "anchor": "center" }, { "atMs": 80, "command": "spawn", "id": "quill", "kind": "quill", "anchor": "left" }, { "atMs": 160, "command": "spawn", "id": "letter", "kind": "glyph", "anchor": "right" }, { "atMs": 240, "command": "orbit", "id": "quill", "anchor": "center", "radius": 0.25, "turns": 0.45, "durationMs": 1260 }, { "atMs": 680, "command": "text", "id": "summary", "slot": "actionSummary", "anchor": "bottom" }] } },
    { "id": "ink-sealing", "when": [{ "field": "status", "op": "eq", "value": "holding" }], "beats": [{ "phase": "decision", "commands": [{ "channel": "light", "token": "ink.hold", "durationMs": 900 }, { "channel": "audio", "cue": "ink.stroke", "gain": "quiet" }, { "channel": "screen", "template": "墨迹正在封入这次确认。", "slots": [] }] }], "timeline": { "durationMs": 1500, "tracks": [{ "atMs": 0, "command": "spawn", "id": "ink", "kind": "inkwell", "anchor": "center" }, { "atMs": 0, "command": "spawn", "id": "letter", "kind": "glyph", "anchor": "top" }, { "atMs": 70, "command": "holdProgress", "id": "hold" }, { "atMs": 160, "command": "pulse", "id": "ink", "to": 1.3, "count": 2, "durationMs": 1000 }, { "atMs": 540, "command": "rotate", "id": "letter", "turns": 0.08, "durationMs": 720 }] } },
    { "id": "ink-writing", "when": [{ "field": "status", "op": "eq", "value": "executing" }], "beats": [{ "phase": "resolution", "commands": [{ "channel": "light", "token": "ink.writing", "durationMs": 1600 }, { "channel": "audio", "cue": "ink.stroke", "gain": "quiet" }, { "channel": "screen", "template": "字句正在写成一段可交付的心意。", "slots": [] }] }], "timeline": { "durationMs": 2300, "tracks": [{ "atMs": 0, "command": "spawn", "id": "ink", "kind": "inkwell", "anchor": "center" }, { "atMs": 0, "command": "spawn", "id": "letter", "kind": "glyph", "anchor": "top" }, { "atMs": 100, "command": "spawn", "id": "quill", "kind": "quill", "anchor": "center" }, { "atMs": 140, "command": "orbit", "id": "quill", "anchor": "center", "radius": 0.3, "turns": 1.1, "durationMs": 1500 }, { "atMs": 460, "command": "pulse", "id": "letter", "to": 1.18, "count": 2, "durationMs": 1080 }, { "atMs": 1240, "command": "particle", "id": "ink-spark", "anchor": "center" }] } },
    { "id": "ink-sent", "when": [{ "field": "status", "op": "eq", "value": "succeeded" }], "beats": [{ "phase": "resolution", "commands": [{ "channel": "light", "token": "ink.seal", "durationMs": 1400 }, { "channel": "audio", "cue": "ink.seal" }, { "channel": "speech", "template": "信已封缄，交给 {{recipientLabel}}。", "slots": ["recipientLabel"] }] }], "timeline": { "durationMs": 2100, "tracks": [{ "atMs": 0, "command": "spawn", "id": "ink", "kind": "inkwell", "anchor": "center" }, { "atMs": 0, "command": "spawn", "id": "letter", "kind": "glyph", "anchor": "top" }, { "atMs": 160, "command": "pulse", "id": "letter", "to": 1.32, "count": 2, "durationMs": 1050 }, { "atMs": 720, "command": "particle", "id": "seal", "anchor": "top" }, { "atMs": 1180, "command": "text", "id": "target", "slot": "recipientLabel", "anchor": "bottom" }] } },
    { "id": "ink-dry", "when": [{ "field": "status", "op": "eq", "value": "failed" }], "beats": [{ "phase": "resolution", "commands": [{ "channel": "light", "token": "ink.failed", "durationMs": 700 }, { "channel": "audio", "cue": "error.soft", "gain": "quiet" }, { "channel": "screen", "template": "墨迹已经收回，邮件没有送出。", "slots": [] }] }], "timeline": { "durationMs": 1100, "tracks": [{ "atMs": 0, "command": "spawn", "id": "ink", "kind": "inkwell", "anchor": "center" }, { "atMs": 120, "command": "shake", "id": "ink", "amplitude": 9, "durationMs": 580 }, { "atMs": 720, "command": "fade", "id": "ink", "to": 0.2 }] } },
    { "id": "ink-denied", "when": [{ "field": "status", "op": "eq", "value": "denied" }], "beats": [{ "phase": "resolution", "commands": [{ "channel": "light", "token": "decision.denied", "durationMs": 460 }, { "channel": "screen", "template": "笔尖停住，邮件没有送出。", "slots": [] }] }], "timeline": { "durationMs": 820, "tracks": [{ "atMs": 0, "command": "spawn", "id": "quill", "kind": "quill", "anchor": "center" }, { "atMs": 180, "command": "fade", "id": "quill", "to": 0.18 }, { "atMs": 280, "command": "particle", "id": "stop", "anchor": "center" }] } },
    { "id": "ink-deferred", "when": [{ "field": "status", "op": "eq", "value": "deferred" }], "beats": [{ "phase": "resolution", "commands": [{ "channel": "light", "token": "decision.deferred", "durationMs": 460 }, { "channel": "screen", "template": "信纸已夹回稍后处理册。", "slots": [] }] }], "timeline": { "durationMs": 900, "tracks": [{ "atMs": 0, "command": "spawn", "id": "letter", "kind": "glyph", "anchor": "center" }, { "atMs": 120, "command": "rotate", "id": "letter", "turns": -0.08, "durationMs": 520 }, { "atMs": 680, "command": "fade", "id": "letter", "to": 0.4 }] } },
    { "id": "ink-expired", "when": [{ "field": "status", "op": "eq", "value": "expired" }], "beats": [{ "phase": "resolution", "commands": [{ "channel": "light", "token": "quiet.fade", "durationMs": 420 }, { "channel": "screen", "template": "墨水干了，确认没有释放邮件。", "slots": [] }] }], "timeline": { "durationMs": 820, "tracks": [{ "atMs": 0, "command": "spawn", "id": "ink", "kind": "inkwell", "anchor": "center" }, { "atMs": 160, "command": "fade", "id": "ink", "to": 0.08 }, { "atMs": 420, "command": "text", "id": "status", "slot": "status", "anchor": "bottom" }] } },
    { "id": "ink-stale", "when": [{ "field": "status", "op": "eq", "value": "stale" }], "beats": [{ "phase": "resolution", "commands": [{ "channel": "light", "token": "warning.stale", "durationMs": 620 }, { "channel": "screen", "template": "信件内容已变化，请重新落笔。", "slots": [] }] }], "timeline": { "durationMs": 1020, "tracks": [{ "atMs": 0, "command": "spawn", "id": "letter", "kind": "glyph", "anchor": "center" }, { "atMs": 140, "command": "shake", "id": "letter", "amplitude": 8, "durationMs": 500 }, { "atMs": 720, "command": "particle", "id": "rewrite", "anchor": "center" }] } }
  ]
}
