{
  "schemaVersion": "2",
  "id": "open-line",
  "version": "0.2.0",
  "priority": 0,
  "license": "Apache-2.0",
  "locales": ["zh-CN", "en"],
  "assets": [],
  "assetDigest": "4f53cda18c2baa0c0354bb5f9a3ecbe5ed12ab4d8e11ba873c2f11161202b945",
  "contentDigest": "739584e913e2466860ed4fbfbbee6c7bd3ee0b17a36d92602ee2a9a21a9b7ec4",
  "matches": { "categories": ["communication.call"], "states": ["waiting", "holding", "executing", "succeeded", "failed", "denied", "deferred", "expired", "stale"] },
  "variants": [
    { "id": "line-ready", "when": [{ "field": "status", "op": "eq", "value": "waiting" }], "beats": [{ "phase": "cue", "commands": [{ "channel": "light", "token": "line.ready", "durationMs": 1000 }, { "channel": "audio", "cue": "line.open", "gain": "quiet" }, { "channel": "screen", "template": "准备联系一位对象。", "slots": [] }] }], "timeline": { "durationMs": 1400, "tracks": [{ "atMs": 0, "command": "spawn", "id": "signal", "kind": "envelope", "anchor": "actor" }, { "atMs": 300, "command": "particle", "id": "ring", "anchor": "center" }, { "atMs": 600, "command": "text", "id": "summary", "slot": "actionSummary", "anchor": "center" }] } },
    { "id": "line-held", "when": [{ "field": "status", "op": "eq", "value": "holding" }], "beats": [{ "phase": "decision", "commands": [{ "channel": "light", "token": "line.hold", "durationMs": 520 }, { "channel": "screen", "template": "正在确认线路。", "slots": [] }] }], "timeline": { "durationMs": 1100, "tracks": [{ "atMs": 0, "command": "spawn", "id": "signal", "kind": "envelope", "anchor": "actor" }, { "atMs": 0, "command": "holdProgress", "id": "hold" }, { "atMs": 540, "command": "scale", "id": "signal", "to": 1.1 }] } },
    { "id": "line-active", "when": [{ "field": "status", "op": "eq", "value": "executing" }], "beats": [{ "phase": "resolution", "commands": [{ "channel": "light", "token": "line.active", "durationMs": 750 }, { "channel": "screen", "template": "线路正在建立。", "slots": [] }] }], "timeline": { "durationMs": 1500, "tracks": [{ "atMs": 0, "command": "spawn", "id": "signal", "kind": "envelope", "anchor": "actor" }, { "atMs": 80, "command": "path", "id": "signal", "from": "actor", "to": "recipient", "arc": 0.2, "durationMs": 1100 }, { "atMs": 1140, "command": "particle", "id": "ring", "anchor": "recipient" }] } },
    { "id": "line-connected", "when": [{ "field": "status", "op": "eq", "value": "succeeded" }], "beats": [{ "phase": "resolution", "commands": [{ "channel": "light", "token": "line.connected", "durationMs": 900 }, { "channel": "audio", "cue": "line.connected" }, { "channel": "speech", "template": "通话指令已交给线路服务。", "slots": [] }] }], "timeline": { "durationMs": 1200, "tracks": [{ "atMs": 0, "command": "spawn", "id": "signal", "kind": "envelope", "anchor": "actor" }, { "atMs": 0, "command": "path", "id": "signal", "from": "actor", "to": "recipient", "arc": 0.2, "durationMs": 720 }, { "atMs": 760, "command": "particle", "id": "connected", "anchor": "recipient" }] } },
    { "id": "line-not-placed", "when": [{ "field": "status", "op": "eq", "value": "failed" }], "beats": [{ "phase": "resolution", "commands": [{ "channel": "light", "token": "line.failed", "durationMs": 620 }, { "channel": "audio", "cue": "error.soft", "gain": "quiet" }, { "channel": "screen", "template": "线路未能建立，电话没有拨出。", "slots": [] }] }], "timeline": { "durationMs": 1000, "tracks": [{ "atMs": 0, "command": "spawn", "id": "signal", "kind": "envelope", "anchor": "center" }, { "atMs": 160, "command": "path", "id": "signal", "from": "center", "to": "actor", "arc": 0.2, "durationMs": 600 }, { "atMs": 780, "command": "text", "id": "status", "slot": "status", "anchor": "actor" }] } },
    { "id": "line-declined", "when": [{ "field": "status", "op": "eq", "value": "denied" }], "beats": [{ "phase": "resolution", "commands": [{ "channel": "light", "token": "decision.denied", "durationMs": 420 }, { "channel": "screen", "template": "这通电话没有拨出。", "slots": [] }] }], "timeline": { "durationMs": 750, "tracks": [{ "atMs": 0, "command": "spawn", "id": "signal", "kind": "envelope", "anchor": "actor" }, { "atMs": 160, "command": "fade", "id": "signal", "to": 0.16 }, { "atMs": 360, "command": "text", "id": "status", "slot": "status", "anchor": "actor" }] } },
    { "id": "line-later", "when": [{ "field": "status", "op": "eq", "value": "deferred" }], "beats": [{ "phase": "resolution", "commands": [{ "channel": "light", "token": "decision.deferred", "durationMs": 420 }, { "channel": "screen", "template": "电话已留待稍后处理。", "slots": [] }] }], "timeline": { "durationMs": 800, "tracks": [{ "atMs": 0, "command": "spawn", "id": "signal", "kind": "envelope", "anchor": "actor" }, { "atMs": 180, "command": "move", "id": "signal", "from": "actor", "to": "center", "durationMs": 340 }, { "atMs": 580, "command": "fade", "id": "signal", "to": 0.42 }] } },
    { "id": "line-expired", "when": [{ "field": "status", "op": "eq", "value": "expired" }], "beats": [{ "phase": "resolution", "commands": [{ "channel": "light", "token": "quiet.fade", "durationMs": 350 }, { "channel": "screen", "template": "确认已过期，电话没有拨出。", "slots": [] }] }], "timeline": { "durationMs": 750, "tracks": [{ "atMs": 0, "command": "spawn", "id": "signal", "kind": "envelope", "anchor": "actor" }, { "atMs": 120, "command": "fade", "id": "signal", "to": 0.08 }, { "atMs": 380, "command": "text", "id": "status", "slot": "status", "anchor": "center" }] } },
    { "id": "line-stale", "when": [{ "field": "status", "op": "eq", "value": "stale" }], "beats": [{ "phase": "resolution", "commands": [{ "channel": "light", "token": "warning.stale", "durationMs": 640 }, { "channel": "screen", "template": "线路状态已变化，请重新确认。", "slots": [] }] }], "timeline": { "durationMs": 900, "tracks": [{ "atMs": 0, "command": "spawn", "id": "signal", "kind": "envelope", "anchor": "center" }, { "atMs": 160, "command": "path", "id": "signal", "from": "center", "to": "actor", "arc": -0.18, "durationMs": 440 }, { "atMs": 660, "command": "particle", "id": "stale", "anchor": "actor" }] } }
  ]
}
