{
  "schemaVersion": "2", "id": "switchboard", "version": "1.0.0", "priority": 19, "license": "Apache-2.0", "locales": ["zh-CN", "en"], "assets": [], "assetDigest": "4f53cda18c2baa0c0354bb5f9a3ecbe5ed12ab4d8e11ba873c2f11161202b945", "contentDigest": "1384f16403a2bd1c062b7441059866820b717729c4786b15cd700813e9e264d0", "preview": "preview.json",
  "matches": { "categories": ["communication.call"], "states": ["waiting", "holding", "executing", "succeeded", "failed", "denied", "deferred", "expired", "stale"] },
  "variants": [
    { "id": "board-waking", "when": [{ "field": "status", "op": "eq", "value": "waiting" }], "beats": [{ "phase": "cue", "commands": [{ "channel": "light", "token": "switchboard.ring", "durationMs": 900 }, { "channel": "audio", "cue": "switchboard.ring", "gain": "quiet" }, { "channel": "screen", "template": "接线台亮起，正在等你决定是否拨通。", "slots": [] }] }], "timeline": { "durationMs": 2100, "tracks": [{ "atMs": 0, "command": "spawn", "id": "board", "kind": "switchboard", "anchor": "center" }, { "atMs": 80, "command": "spawn", "id": "dial", "kind": "dial", "anchor": "top" }, { "atMs": 180, "command": "pulse", "id": "board", "to": 1.12, "count": 3, "durationMs": 1180 }, { "atMs": 620, "command": "text", "id": "summary", "slot": "actionSummary", "anchor": "bottom" }] } },
    { "id": "board-locking", "when": [{ "field": "status", "op": "eq", "value": "holding" }], "beats": [{ "phase": "decision", "commands": [{ "channel": "light", "token": "switchboard.lock", "durationMs": 900 }, { "channel": "audio", "cue": "switchboard.route", "gain": "quiet" }, { "channel": "screen", "template": "正在插好这通外呼的线路。", "slots": [] }] }], "timeline": { "durationMs": 1500, "tracks": [{ "atMs": 0, "command": "spawn", "id": "board", "kind": "switchboard", "anchor": "center" }, { "atMs": 0, "command": "spawn", "id": "dial", "kind": "dial", "anchor": "top" }, { "atMs": 60, "command": "holdProgress", "id": "hold" }, { "atMs": 180, "command": "rotate", "id": "dial", "turns": 1, "durationMs": 940 }, { "atMs": 300, "command": "pulse", "id": "board", "to": 1.22, "count": 2, "durationMs": 920 }] } },
    { "id": "board-routing", "when": [{ "field": "status", "op": "eq", "value": "executing" }], "beats": [{ "phase": "resolution", "commands": [{ "channel": "light", "token": "switchboard.route", "durationMs": 1800 }, { "channel": "audio", "cue": "switchboard.route", "gain": "quiet" }, { "channel": "screen", "template": "接线员正在把两端接入同一条线路。", "slots": [] }] }], "timeline": { "durationMs": 2300, "tracks": [{ "atMs": 0, "command": "spawn", "id": "board", "kind": "switchboard", "anchor": "center" }, { "atMs": 0, "command": "spawn", "id": "dial", "kind": "dial", "anchor": "top" }, { "atMs": 120, "command": "spawn", "id": "tone", "kind": "orb", "anchor": "center" }, { "atMs": 160, "command": "orbit", "id": "tone", "anchor": "center", "radius": 0.31, "turns": 1.45, "durationMs": 1480 }, { "atMs": 180, "command": "rotate", "id": "dial", "turns": 2.2, "durationMs": 1420 }, { "atMs": 1240, "command": "particle", "id": "route", "anchor": "center" }] } },
    { "id": "board-live", "when": [{ "field": "status", "op": "eq", "value": "succeeded" }], "beats": [{ "phase": "resolution", "commands": [{ "channel": "light", "token": "switchboard.live", "durationMs": 1400 }, { "channel": "audio", "cue": "switchboard.live" }, { "channel": "speech", "template": "线路已交给外呼服务。", "slots": [] }] }], "timeline": { "durationMs": 2050, "tracks": [{ "atMs": 0, "command": "spawn", "id": "board", "kind": "switchboard", "anchor": "center" }, { "atMs": 0, "command": "spawn", "id": "dial", "kind": "dial", "anchor": "top" }, { "atMs": 160, "command": "pulse", "id": "board", "to": 1.26, "count": 3, "durationMs": 1120 }, { "atMs": 700, "command": "particle", "id": "live", "anchor": "center" }, { "atMs": 1280, "command": "text", "id": "target", "slot": "recipientLabel", "anchor": "bottom" }] } },
    { "id": "board-failed", "when": [{ "field": "status", "op": "eq", "value": "failed" }], "beats": [{ "phase": "resolution", "commands": [{ "channel": "light", "token": "switchboard.failed", "durationMs": 700 }, { "channel": "audio", "cue": "error.soft", "gain": "quiet" }, { "channel": "screen", "template": "线路没有建立，电话没有拨出。", "slots": [] }] }], "timeline": { "durationMs": 1120, "tracks": [{ "atMs": 0, "command": "spawn", "id": "board", "kind": "switchboard", "anchor": "center" }, { "atMs": 130, "command": "shake", "id": "board", "amplitude": 12, "durationMs": 620 }, { "atMs": 780, "command": "fade", "id": "board", "to": 0.22 }] } },
    { "id": "board-denied", "when": [{ "field": "status", "op": "eq", "value": "denied" }], "beats": [{ "phase": "resolution", "commands": [{ "channel": "light", "token": "decision.denied", "durationMs": 480 }, { "channel": "screen", "template": "接线台保持静默。", "slots": [] }] }], "timeline": { "durationMs": 820, "tracks": [{ "atMs": 0, "command": "spawn", "id": "dial", "kind": "dial", "anchor": "center" }, { "atMs": 150, "command": "fade", "id": "dial", "to": 0.18 }, { "atMs": 260, "command": "particle", "id": "mute", "anchor": "center" }] } },
    { "id": "board-deferred", "when": [{ "field": "status", "op": "eq", "value": "deferred" }], "beats": [{ "phase": "resolution", "commands": [{ "channel": "light", "token": "decision.deferred", "durationMs": 460 }, { "channel": "screen", "template": "这通电话留在待接线队列。", "slots": [] }] }], "timeline": { "durationMs": 900, "tracks": [{ "atMs": 0, "command": "spawn", "id": "board", "kind": "switchboard", "anchor": "center" }, { "atMs": 160, "command": "pulse", "id": "board", "to": 0.72, "count": 1, "durationMs": 520 }, { "atMs": 720, "command": "fade", "id": "board", "to": 0.42 }] } },
    { "id": "board-expired", "when": [{ "field": "status", "op": "eq", "value": "expired" }], "beats": [{ "phase": "resolution", "commands": [{ "channel": "light", "token": "quiet.fade", "durationMs": 420 }, { "channel": "screen", "template": "接线请求已过期，电话没有拨出。", "slots": [] }] }], "timeline": { "durationMs": 820, "tracks": [{ "atMs": 0, "command": "spawn", "id": "board", "kind": "switchboard", "anchor": "center" }, { "atMs": 160, "command": "fade", "id": "board", "to": 0.08 }, { "atMs": 430, "command": "text", "id": "status", "slot": "status", "anchor": "bottom" }] } },
    { "id": "board-stale", "when": [{ "field": "status", "op": "eq", "value": "stale" }], "beats": [{ "phase": "resolution", "commands": [{ "channel": "light", "token": "warning.stale", "durationMs": 640 }, { "channel": "screen", "template": "线路状态变化，请重新确认。", "slots": [] }] }], "timeline": { "durationMs": 1040, "tracks": [{ "atMs": 0, "command": "spawn", "id": "dial", "kind": "dial", "anchor": "center" }, { "atMs": 120, "command": "shake", "id": "dial", "amplitude": 9, "durationMs": 540 }, { "atMs": 720, "command": "particle", "id": "reset", "anchor": "center" }] } }
  ]
}
