{
  "schemaVersion": "2",
  "id": "quiet-night",
  "version": "0.2.0",
  "priority": 100,
  "license": "Apache-2.0",
  "locales": ["zh-CN", "en"],
  "assets": [],
  "assetDigest": "4f53cda18c2baa0c0354bb5f9a3ecbe5ed12ab4d8e11ba873c2f11161202b945",
  "contentDigest": "f602a009630a794b03b52a19512e71c1ce0505c31cab3bd126aaa94827100b53",
  "matches": { "categories": ["communication.send", "communication.call", "calendar.create", "system.deploy"], "states": ["waiting", "holding", "executing", "succeeded", "failed", "denied", "deferred", "expired", "stale"] },
  "variants": [
    { "id": "night-awaiting", "when": [{ "field": "timeOfDay", "op": "eq", "value": "night" }, { "field": "status", "op": "eq", "value": "waiting" }], "beats": [{ "phase": "cue", "commands": [{ "channel": "light", "token": "quiet.await", "durationMs": 900 }, { "channel": "screen", "template": "夜间静默：有一项行动等待确认。", "slots": [] }] }], "timeline": { "durationMs": 900, "tracks": [{ "atMs": 0, "command": "spawn", "id": "quiet", "kind": "envelope", "anchor": "actor" }, { "atMs": 160, "command": "fade", "id": "quiet", "to": 0.62 }, { "atMs": 390, "command": "text", "id": "summary", "slot": "actionSummary", "anchor": "center" }] } },
    { "id": "night-holding", "when": [{ "field": "timeOfDay", "op": "eq", "value": "night" }, { "field": "status", "op": "eq", "value": "holding" }], "beats": [{ "phase": "decision", "commands": [{ "channel": "light", "token": "quiet.hold", "durationMs": 520 }, { "channel": "screen", "template": "正在确认。", "slots": [] }] }], "timeline": { "durationMs": 850, "tracks": [{ "atMs": 0, "command": "spawn", "id": "quiet", "kind": "envelope", "anchor": "actor" }, { "atMs": 0, "command": "holdProgress", "id": "hold" }, { "atMs": 510, "command": "scale", "id": "quiet", "to": 1.04 }] } },
    { "id": "night-executing", "when": [{ "field": "timeOfDay", "op": "eq", "value": "night" }, { "field": "status", "op": "eq", "value": "executing" }], "beats": [{ "phase": "resolution", "commands": [{ "channel": "light", "token": "quiet.route", "durationMs": 700 }, { "channel": "screen", "template": "正在完成。", "slots": [] }] }], "timeline": { "durationMs": 950, "tracks": [{ "atMs": 0, "command": "spawn", "id": "quiet", "kind": "envelope", "anchor": "actor" }, { "atMs": 60, "command": "path", "id": "quiet", "from": "actor", "to": "recipient", "arc": 0.12, "durationMs": 700 }, { "atMs": 740, "command": "fade", "id": "quiet", "to": 0.75 }] } },
    { "id": "night-confirmed", "when": [{ "field": "timeOfDay", "op": "eq", "value": "night" }, { "field": "status", "op": "eq", "value": "succeeded" }], "beats": [{ "phase": "resolution", "commands": [{ "channel": "light", "token": "quiet.confirm", "durationMs": 340 }, { "channel": "screen", "template": "已完成。", "slots": [] }] }], "timeline": { "durationMs": 850, "tracks": [{ "atMs": 0, "command": "spawn", "id": "quiet", "kind": "envelope", "anchor": "actor" }, { "atMs": 0, "command": "path", "id": "quiet", "from": "actor", "to": "recipient", "arc": 0.12, "durationMs": 540 }, { "atMs": 580, "command": "particle", "id": "arrive", "anchor": "recipient" }] } },
    { "id": "night-failed", "when": [{ "field": "timeOfDay", "op": "eq", "value": "night" }, { "field": "status", "op": "eq", "value": "failed" }], "beats": [{ "phase": "resolution", "commands": [{ "channel": "light", "token": "quiet.warning", "durationMs": 520 }, { "channel": "screen", "template": "没有完成，明天再处理。", "slots": [] }] }], "timeline": { "durationMs": 850, "tracks": [{ "atMs": 0, "command": "spawn", "id": "quiet", "kind": "envelope", "anchor": "center" }, { "atMs": 100, "command": "path", "id": "quiet", "from": "center", "to": "actor", "arc": 0.1, "durationMs": 520 }, { "atMs": 660, "command": "fade", "id": "quiet", "to": 0.28 }] } },
    { "id": "night-denied", "when": [{ "field": "timeOfDay", "op": "eq", "value": "night" }, { "field": "status", "op": "eq", "value": "denied" }], "beats": [{ "phase": "resolution", "commands": [{ "channel": "light", "token": "quiet.fade", "durationMs": 300 }, { "channel": "screen", "template": "没有执行。", "slots": [] }] }], "timeline": { "durationMs": 700, "tracks": [{ "atMs": 0, "command": "spawn", "id": "quiet", "kind": "envelope", "anchor": "actor" }, { "atMs": 140, "command": "fade", "id": "quiet", "to": 0.12 }, { "atMs": 360, "command": "text", "id": "status", "slot": "status", "anchor": "actor" }] } },
    { "id": "night-deferred", "when": [{ "field": "timeOfDay", "op": "eq", "value": "night" }, { "field": "status", "op": "eq", "value": "deferred" }], "beats": [{ "phase": "resolution", "commands": [{ "channel": "light", "token": "quiet.fade", "durationMs": 300 }, { "channel": "screen", "template": "已留待稍后处理。", "slots": [] }] }], "timeline": { "durationMs": 700, "tracks": [{ "atMs": 0, "command": "spawn", "id": "quiet", "kind": "envelope", "anchor": "actor" }, { "atMs": 160, "command": "move", "id": "quiet", "from": "actor", "to": "center", "durationMs": 300 }, { "atMs": 500, "command": "fade", "id": "quiet", "to": 0.28 }] } },
    { "id": "night-expired", "when": [{ "field": "timeOfDay", "op": "eq", "value": "night" }, { "field": "status", "op": "eq", "value": "expired" }], "beats": [{ "phase": "resolution", "commands": [{ "channel": "light", "token": "quiet.fade", "durationMs": 300 }, { "channel": "screen", "template": "确认已过期。", "slots": [] }] }], "timeline": { "durationMs": 700, "tracks": [{ "atMs": 0, "command": "spawn", "id": "quiet", "kind": "envelope", "anchor": "actor" }, { "atMs": 100, "command": "fade", "id": "quiet", "to": 0.05 }, { "atMs": 360, "command": "text", "id": "status", "slot": "status", "anchor": "center" }] } },
    { "id": "night-stale", "when": [{ "field": "timeOfDay", "op": "eq", "value": "night" }, { "field": "status", "op": "eq", "value": "stale" }], "beats": [{ "phase": "resolution", "commands": [{ "channel": "light", "token": "quiet.warning", "durationMs": 480 }, { "channel": "screen", "template": "状态已变化，等待重新确认。", "slots": [] }] }], "timeline": { "durationMs": 820, "tracks": [{ "atMs": 0, "command": "spawn", "id": "quiet", "kind": "envelope", "anchor": "center" }, { "atMs": 100, "command": "path", "id": "quiet", "from": "center", "to": "actor", "arc": -0.1, "durationMs": 440 }, { "atMs": 600, "command": "particle", "id": "stale", "anchor": "actor" }] } }
  ]
}
